{
  "tags": [
    "updraft",
    "vote",
    "networks"
  ],
  "name": "Updraft Networks",
  "description": "Vote to decide which networks will have UPD liquidity pools and Updraft app support.",
  "link": "https://guide.updraft.fund/updraft/voting/networks",
  "image": {
    "url": "https://www.updraft.fund/assets/updraft-logo-RWOFZEhD.png",
    "alt": "Updraft logo"
  },
  "funding": [
    {
      "token": "UPD",
      "amount": 1000000
    }
  ],
  "active": true
}